Python 3.14.3 (tags/v3.14.3:323c59a, Feb  3 2026, 16:04:56) [MSC v.1944 64 bit (AMD64)] on win32
Enter "help" below or click "Help" above for more information.

= RESTART: C:\Users\micha\Documents\Private\AI\Goldbach\Github\amplification_testing.py
No k values specified, using default: k=5-15

======================================================================
AMPLIFICATION TESTING FOR PRIMORIALS
======================================================================
Testing k ∈ [5, 20] (16 primorials)
Samples per k: 2,000

[1/16] 
======================================================================
Testing k=5: N = p_5# = 2,310
Range: [13, 1,300], Samples: 2,000
======================================================================
Results: 128 found / 35.1 expected = 3.65× amplification
Theory: 4.27×, Status: ✓ SUCCESS
Time: 0.02s
[2/16] 
======================================================================
Testing k=6: N = p_6# = 30,030
Range: [17, 1,700], Samples: 2,000
======================================================================
Results: 127 found / 33.3 expected = 3.82× amplification
Theory: 4.57×, Status: ✓ SUCCESS
Time: 0.02s
[3/16] 
======================================================================
Testing k=7: N = p_7# = 510,510
Range: [19, 1,900], Samples: 2,000
======================================================================
Results: 117 found / 28.4 expected = 4.12× amplification
Theory: 5.05×, Status: ✓ SUCCESS
Time: 0.03s
[4/16] 
======================================================================
Testing k=8: N = p_8# = 9,699,690
Range: [23, 2,300], Samples: 2,000
======================================================================
Results: 103 found / 27.4 expected = 3.76× amplification
Theory: 5.24×, Status: ✓ SUCCESS
Time: 0.05s
[5/16] 
======================================================================
Testing k=9: N = p_9# = 223,092,870
Range: [29, 2,900], Samples: 2,000
======================================================================
Results: 120 found / 28.2 expected = 4.26× amplification
Theory: 5.58×, Status: ✓ SUCCESS
Time: 0.05s
[6/16] 
======================================================================
Testing k=10: N = p_10# = 6,469,693,230
Range: [31, 3,100], Samples: 2,000
======================================================================
Results: 136 found / 25.2 expected = 5.39× amplification
Theory: 6.00×, Status: ✓ SUCCESS
Time: 0.06s
[7/16] 
======================================================================
Testing k=11: N = p_11# = 200,560,490,130
Range: [37, 3,700], Samples: 2,000
======================================================================
Results: 128 found / 25.6 expected = 5.00× amplification
Theory: 6.12×, Status: ✓ SUCCESS
Time: 0.05s
[8/16] 
======================================================================
Testing k=12: N = p_12# = 7,420,738,134,810
Range: [41, 4,100], Samples: 2,000
======================================================================
Results: 136 found / 24.6 expected = 5.52× amplification
Theory: 6.43×, Status: ✓ SUCCESS
Time: 0.06s
[9/16] 
======================================================================
Testing k=13: N = p_13# = 304,250,263,527,210
Range: [43, 4,300], Samples: 2,000
======================================================================
Results: 125 found / 22.8 expected = 5.47× amplification
Theory: 6.61×, Status: ✓ SUCCESS
Time: 0.06s
[10/16] 
======================================================================
Testing k=14: N = p_14# = 13,082,761,331,670,030
Range: [47, 4,700], Samples: 2,000
======================================================================
Results: 115 found / 22.1 expected = 5.21× amplification
Theory: 6.70×, Status: ✓ SUCCESS
Time: 0.06s
[11/16] 
======================================================================
Testing k=15: N = p_15# = 614,889,782,588,491,410
Range: [53, 5,300], Samples: 2,000
======================================================================
Results: 118 found / 22.1 expected = 5.33× amplification
Theory: 6.86×, Status: ✓ SUCCESS
Time: 0.07s
[12/16] 
======================================================================
Testing k=16: N = p_16# = 32,589,158,477,190,044,730
Range: [59, 5,900], Samples: 2,000
======================================================================
Results: 106 found / 22.3 expected = 4.75× amplification
Theory: 7.07×, Status: ✓ SUCCESS
Time: 0.08s
[13/16] 
======================================================================
Testing k=17: N = p_17# = 1,922,760,350,154,212,639,070
Range: [61, 6,100], Samples: 2,000
======================================================================
Results: 117 found / 21.0 expected = 5.58× amplification
Theory: 7.26×, Status: ✓ SUCCESS
Time: 0.09s
[14/16] 
======================================================================
Testing k=18: N = p_18# = 117,288,381,359,406,970,983,270
Range: [67, 6,700], Samples: 2,000
======================================================================
Results: 113 found / 21.0 expected = 5.38× amplification
Theory: 7.32×, Status: ✓ SUCCESS
Time: 0.09s
[15/16] 
======================================================================
Testing k=19: N = p_19# = 7,858,321,551,080,267,055,879,090
Range: [71, 7,100], Samples: 2,000
======================================================================
Results: 110 found / 20.5 expected = 5.37× amplification
Theory: 7.49×, Status: ✓ SUCCESS
Time: 0.07s
[16/16] 
======================================================================
Testing k=20: N = p_20# = 557,940,830,126,698,960,967,415,390
Range: [73, 7,300], Samples: 2,000
======================================================================
Results: 109 found / 19.5 expected = 5.59× amplification
Theory: 7.59×, Status: ✓ SUCCESS
Time: 0.08s

======================================================================
SUMMARY - AMPLIFICATION FACTORS
======================================================================

  k |               N |  Tested |   Found |     Amp |  Theory |   Status
----------------------------------------------------------------------
  5 |           2,310 |     206 |     128 |    3.65× |    4.27× |   ✓ PASS
  6 |          30,030 |     260 |     127 |    3.82× |    4.57× |   ✓ PASS
  7 |         510,510 |     283 |     117 |    4.12× |    5.05× |   ✓ PASS
  8 |       9,699,690 |     334 |     103 |    3.76× |    5.24× |   ✓ PASS
  9 |     223,092,870 |     410 |     120 |    4.26× |    5.58× |   ✓ PASS
 10 |   6,469,693,230 |     432 |     136 |    5.39× |    6.00× |   ✓ PASS
 11 | 200,560,490,130 |     505 |     128 |    5.00× |    6.12× |   ✓ PASS
 12 | 7,420,738,134,810 |     553 |     136 |    5.52× |    6.43× |   ✓ PASS
 13 | 304,250,263,527,210 |     577 |     125 |    5.47× |    6.61× |   ✓ PASS
 14 | 13,082,761,331,670,030 |     620 |     115 |    5.21× |    6.70× |   ✓ PASS
 15 | 614,889,782,588,491,410 |     687 |     118 |    5.33× |    6.86× |   ✓ PASS
 16 | 32,589,158,477,190,044,730 |     760 |     106 |    4.75× |    7.07× |   ✓ PASS
 17 | 1,922,760,350,154,212,639,070 |     778 |     117 |    5.58× |    7.26× |   ✓ PASS
 18 | 117,288,381,359,406,970,983,270 |     845 |     113 |    5.38× |    7.32× |   ✓ PASS
 19 | 7,858,321,551,080,267,055,879,090 |     890 |     110 |    5.37× |    7.49× |   ✓ PASS
 20 | 557,940,830,126,698,960,967,415,390 |     910 |     109 |    5.59× |    7.59× |   ✓ PASS

======================================================================
STATISTICAL SUMMARY
======================================================================

Amplification factors:
  Range: 3.65× - 5.59×
  Average: 4.89×
  Median: 5.27×
  Std Dev: 0.70×

Success rate:
  Successes: 16/16 (100.0%)

Total computation time: 1.03s
Average time per primorial: 0.06s

======================================================================
COMPARISON WITH THEORY
======================================================================

Theoretical prediction: e^γ·log(p_k) ≈ 1.78·log(p_k)
Observed/Theory ratio: 0.78
✓ Good agreement with theory

Note: Paper reports 8-13× for k=43-124 due to:
  1. Higher log(p_k) values (≈7-8 vs 2-4 here)
  2. Additional structural effects from LPF symmetry

